{
  "schema_version": "0.1",
  "run_id": "multiqc-mvp-20260902",
  "path_base": "repository-root",
  "input_root": "specs/005-skills-nextflow-research-core/evaluation/cases/multiqc-mvp/inputs",
  "files": [
    {
      "path": "specs/005-skills-nextflow-research-core/evaluation/cases/multiqc-mvp/inputs/sample_fastqc/fastqc_data.txt",
      "size": 281,
      "sha256": "00973b47dce88d287b94449f13573c957b8104aa4b1addabb894bed04b11c96b"
    }
  ],
  "sha256": "8d9145adb39c7915ac5e3302cc5345527a6de4d7bbb74cf64f68a878c1767725"
}
